Product_Name,Discount,MRP,Selling_Price,Brand,Manufacturer,Series,Colour,Form_Factor,Standing_Screen_Display_Size,Screen_Resolution,Resolution,Package_Dimensions,Item_Model_Number,Processor_Brand,Processor_Type,Processor_Speed,Processor_Count,Memory_Technology,Computer_Memory_Type,Maximum_Memory_Supported,Hard_Disk_Description,Hard_Drive_Interface,Graphics_Coprocessor,Graphics_Chipset_Brand,Graphics_Card_Description,Graphics_RAM_Type,Graphics_Card_RAM_Size,Graphics_Card_Interface,Connectivity_Type,Wireless_Type,Number_of_HDMI_Ports,Optical_Drive_Type,Operating_System,Are_Batteries_Included,Lithium_Battery_Energy_Content,Number_of_Lithium_Ion_Cells,Included_Components,Country_of_Origin,Item_Weight
"ASUS ROG Strix G16, AMD Ryzen 9 8940HX, Gaming Laptop(RTX 5050-8GB/115W TGP/16GB RAM/1TB SSD/FHD+/16""/165Hz/90Whr/Windows 11/M365 Basic (1Year)*/Office Home 2024/Eclipse Gray/2.5 Kg) G614PH-RV033WS",-3%,"₹1,44,990₹1,44,990","1,39,990.",‎ASUS,"‎ASUS, INVENTEC (CHONGQING) CORPORATION, NO.66, WEST DISTRICT 2ND RD, SHAPINGBA DISTRICT, CHONGQING, CHINA 401331",‎ROG Strix G16,‎Eclipse Gray,‎gaming laptop,‎16 Inches,‎1920 x 1200 pixels,‎1920 x 1200 pixels,‎43.9 x 33.79 x 10.7 cm; 2.5 kg,‎G614PH-RV033WS,‎AMD,‎Ryzen 9,‎2.4 GHz,‎16,‎DDR5,‎DDR5 RAM,‎16 GB,‎SSD,‎USB,‎NVIDIA GeForce RTX 5050,‎NVIDIA,‎Dedicated,‎GDDR7,,‎Integrated,‎Bluetooth,‎Bluetooth,‎1,‎No Optical Storage,‎Windows 11 Home,‎Yes,‎90 Watt Hours,‎4,"‎Laptop, Power Adaptor, User Guide, Warranty Documents",‎China,‎2 kg 500 g
"Acer [SmartChoice Aspire 3 Laptop Intel Core Celeron N4500 Processor Laptop (8 GB LPDDR4X SDRAM/512 GB SSD/Win11 Home/38 WHR/HD Webcam) A325-45 with 39.63 cm (15.6"") HD Display, Pure Silver, 1.5 KG",-34%,"₹33,999₹33,999","22,490.",‎acer,"‎ACER INDIA (PRIVATE) LTD, R.S. no 38/2, Sederapet Village,Villianur Commune,Puducherry-605111, Acer",‎Aspire 3,‎Silver,‎Ultra-Portable,‎15.6 Inches,‎1366 x 768 pixels,‎1366 x 768 pixels,,‎A325-45,‎Intel,‎Others,‎1.1 GHz,‎1,‎LPDDR4X,‎SDRAM,‎8 GB,‎SSD,‎Ethernet,‎â€ŽIntel Celeron N4500,‎Intel,‎Integrated,‎SDRAM,,‎Integrated,‎Wi-Fi,‎Bluetooth,‎1,,‎Windows 11 Home,‎Yes,‎38 Watt Hours,‎2,"‎1U (contains Laptop 1N, Power cord 1N, Adapter 1N, User Manual 1N)",‎India,‎2 kg 150 g
"HP 255 G10 AMD Athlon Dual Core 7120U - (8 GB/256 GB SSD/Windows 11 Home) Thin and Light Laptop (15.6 inch, Ash Silver, 1.35 kg)",-26%,"₹30,336₹30,336","22,390.",‎HP,"‎HP, HP India",‎HP Laptop,‎Silver,‎Netbook,‎39.6 Centimetres,‎1366 x 768 pixels,‎1366 x 768 pixels,‎52.6 x 31.4 x 6.6 cm; 1.52 kg,‎B69V0PT#ACJ,‎AMD,‎Others,‎3.5 GHz,‎1,‎DDR4,‎DDR4 SDRAM,‎8 GB,‎SSD,‎USB,‎AMD Radeon 610M Graphics,‎AMD,‎Integrated,‎DDR4 SDRAM,,‎Integrated,‎Wi-Fi,‎802.11ax,‎1,,‎Windows 11,‎Yes,‎41 Watt Hours,‎3,"‎Laptop, charger",‎China,‎1 kg 520 g
"HP 15s, 12th Gen Intel Core i3-1215U (8GB DDR4, 512GB SSD) Anti-Glare, 15.6""/39.6cm,FHD, Win 11, MS Office 21, Silver, 1.69kg, fy5006tu/fd0751tu/fd0752tu, UHD Graphics, HD Camera, Dual Speakers Laptop",-50%,"₹69,999₹69,999","34,999.",‎HP,"‎HP, Techfront HP 1800 258 7170",‎HP Laptop,‎Natural Silver,‎Ultra-Portable,‎39.6 Centimetres,‎1920 x 1080 pixels,‎1920 x 1080 pixels,,‎91R02PA,‎Intel,‎Core i3,‎4.4 GHz,‎1,‎DDR4,‎DDR4 SDRAM,‎8 GB,‎SSD,‎USB-C,‎Intel,‎Intel,‎Integrated,‎VRAM,,‎PCI Express,"‎Bluetooth, Wi-Fi",‎Bluetooth,‎1,,‎Windows 11 Home,‎Yes,‎41 Watt Hours,‎3,"‎Laptop, Power Adapter, User Manual",,‎1 kg 700 g
"HP 15, AMD Ryzen 3 7320U (8GB LPDDR5, 512GB SSD) FHD, Anti-Glare, Micro-Edge, 15.6""/39.6cm, Win 11, Office 21, Silver, 1.59kg, fc0154AU, AMD Radeon Graphics, 1080p FHD Camera Laptop",-35%,"₹48,419₹48,419","31,490.",‎HP,"‎HP, HP",‎HP Laptop,‎Light Silver,‎Ultra-Portable,‎39.6 Centimetres,‎1366 x 768 pixels,‎1366 x 768 pixels,‎52.1 x 31 x 6.9 cm; 1.59 kg,‎9D3M8PA,‎AMD,‎Ryzen 3,‎4.1 GHz,‎1,‎DDR5,‎DDR5 RAM,‎8 GB,‎Solid State Hard Drive,‎USB,‎AMD Radeon Graphics,‎AMD,‎Integrated,‎VRAM,,‎Integrated,‎Bluetooth,‎Bluetooth,‎1,,‎Windows,‎Yes,‎41 Watt Hours,‎3,"‎Laptop, charger",‎India,‎1 kg 590 g
"Acer ALG, Intel Core i5 13th Gen - 13420H, NVIDIA GeForce RTX 3050-6GB DDR6, 16GB RAM, 512GB SSD, FHD 15.6""/39.62 cm, 144Hz, Windows 11 Home, Steel Gray, 1.99 KG, AL15G-53,Gaming Laptop",-20%,"₹74,999₹74,999","59,990.",‎acer,"‎Acer, Huaqin, Nanchang HuaQin Electronic Technology Co., Ltd. No. 2999 Tianxiang Road, High-tech Zone, Nanchang , Jiangxi, China",‎Acer ALG,‎Gray,‎Ultra-Portable,‎15.6 Inches,‎1920 x 1080 pixels,‎1920 x 1080 pixels,‎48.1 x 31.7 x 9.1 cm; 1.9 kg,‎AL15G-53,‎Intel,‎Core i5,‎2.1 GHz,‎1,‎DDR4,‎DDR4 SDRAM,‎64 GB,‎SSD,‎Solid State,‎NVIDIA GeForce RTX 3050,‎NVIDIA,‎Dedicated,‎GDDR6,,‎AGP,"‎Bluetooth, Wi-Fi",‎Bluetooth,‎1,,‎Windows 11 Home,‎Yes,‎54 Watt Hours,‎4,"‎‎1U (contains Laptop 1N, Power cord 1N, Adapter 1N, User Manual 1N)",‎China,‎1 kg 900 g
"Lenovo V15 G4 AMD Ryzen 5 7520U 15.6 inch FHD Thin & Lite Laptop, AMD Graphics, 16GB DDR5 5500Mhz Ram, 512GB SSD NVMe, Windows 11, Dolby Audio, Arctic Grey, 1 Year Onsite Brand Warranty",-39%,"₹54,900₹54,900","33,690.",‎Lenovo,"‎Lenovo India Pvt Ltd, lenovo india",‎V15 G4 AMN,‎Gray,‎Laptop,‎15.6 Inches,‎1920 x 1080 pixels,‎1920 x 1080 pixels,,‎83CQA00WIN,‎AMD,‎Ryzen 5,‎4.3 GHz,‎1,‎SO-DIMM,‎DDR5 RAM,‎16 GB,‎SSD,‎Solid State,‎Integrated AMD Radeon™ 610M Graphics,‎AMD,‎Integrated,‎DDR5 SDRAM,,‎Integrated,"‎Standard Ports 2x USB 3.2 Gen 1 1x USB-C® 3.2 Gen 1 (support data transfer, Power Delivery (20V only) and DisplayPort™ 1.2) 1x HDMI® 1.4b 1x Headphone / microphone combo jack (3.5mm) 1x Ethernet (RJ-45) 1x Power connector, WLAN + Bluetooth Wi-Fi® 6, 802.11ax 2x2 + BT5.2",‎Bluetooth,‎1,,‎Windows 11,‎Yes,‎1 Watt Hours,‎1,"‎Adaptor, Laptop, Power chord",,
"Dell 15 Thin & Light Laptop, 13th Generation Intel Core i3-1305U Processor, 8GB DDR4 + 512GB SSD, 15.6"" (39.62cm) FHD 120Hz 250 nits Display, Windows 11 + MSO'24, 12 Month McAfee, Grey, 1.69kg",-25%,"₹49,518₹49,518","36,990.",‎Dell,"‎DELL, Dell India Pvt Ltd",‎Inspiron,‎Carbon Black,‎Laptop,‎15.6 Inches,‎1920 x 1080 pixels,‎1920 x 1080 pixels,,‎Inspiron 3530,‎Intel,‎Core i3,‎3.3 GHz,‎1,‎DDR4,‎DDR4 SDRAM,‎16 GB,‎SSD,‎USB 3.2,‎integrated,‎Intel,‎Integrated,‎Shared,,‎Integrated,‎Wi-Fi,‎Bluetooth,‎1,,‎Windows 11 Home,‎Yes,‎2.6 Watt Hours,‎1,"‎‎‎‎Laptop, Battery, AC Adapter, User Guide, Manuals",‎China,‎1 kg 620 g
"acer Aspire Go 14, Intel Core Ultra 5 125H (14th Gen),16GB DDR5 RAM/512GB SSD, WUXGA IPS, 14.0""/35.56 cm, Win 11, MS Office, Steel Gray, 1.5 kg, AG14-71M,Backlit Keyboard, AI Powered Premium Laptop",-27%,"₹72,999₹72,999","52,999.",‎Acer,"‎Acer, Golden Elite Technology ( SHENZHEN ) LTD. No.1, Nan-Huan Rd., Shajing, BaoAn, Shenzhen, China",‎Aspire Go 14,‎Gray,‎Ultra-Portable,‎14 Inches,‎1920 x 1200 pixels,‎1920 x 1200 pixels,‎48.8 x 45.7 x 10.2 cm; 1.5 kg,‎AG14-71M,‎Intel,‎Intel Core Ultra 5,‎3.6 GHz,‎1,‎DDR5,‎DDR5 RAM,‎32 GB,‎SSD,‎Solid State,‎Intel Graphics,‎Intel,‎Integrated,‎SDRAM,,‎Integrated,‎Bluetooth,‎Bluetooth,‎1,,‎Windows 11 Home,‎Yes,‎55 Watt Hours,‎3,"‎‎1U (contains Laptop 1N, Power cord 1N, Adapter 1N, User Manual 1N)",‎China,‎1 kg 500 g
"ASUS Vivobook Go 14, AMD Ryzen 5 7520U,Thin & Light Laptop (AMD Radeon iGPU/16GB RAM/512GB SSD/FHD/14/60Hz/42WHrs/Windows 11/M365 Basic (1Year)*/Office Home 2024/Mixed Black/1.38 kg) E1404FA-NK5542WS",-28%,"₹52,990₹52,990","37,990.",‎ASUS,"‎ASUS, DIGITEK (CHONGQING) Limited, B01 SEC C Airport Function Zone Lianglu Cuntan Free Trade Port Area, Yubei District, China",‎ASUS Vivobook Go 14,‎Black | 16GB RAM,‎thin & light,‎14 Inches,‎1920 x 1080 pixels,‎1920 x 1080 pixels,‎44.5 x 29.1 x 6.5 cm; 1.21 kg,‎E1404FA-NK5542WS,‎AMD,‎Ryzen 5,‎2.8 GHz,‎3,‎Lpddr 5,‎DDR5 RAM,‎16 GB,‎SSD,‎USB,‎AMD Radeon™ Graphics,‎AMD,‎Integrated,‎Shared,,‎Integrated,‎Wi-Fi,‎Bluetooth,‎1,‎No Optical Storage,‎Windows 11 Home,‎Yes,‎42 Watt Hours,‎3,"‎Laptop, Power Adaptor, User Guide, Warranty Documents",‎China,‎1 kg 210 g
"JioBook 11 with Lifetime Office/Android 4G Laptop Mediatek 8788 (JioOS) / Octa-core/ 4GB RAM / 64 eMMC Storage/Thin and Light Laptop (11.6 inch, 990 Grams)/ Dual Band WiFi + SIM/Blue",-48%,"₹25,000₹25,000","12,990.",‎Jio,"‎Hunan Greatwall Computer System Co.,Ltd, Tianyi Science and Technology City, Xiangyun Middle Road Tianyuan District, Zhuzhou , Hunan Province, China 412000; Contact: 1800 89 09999 ; email: care@jio.com, Hunan Greatwall Computer Systems Co., Ltd.",‎JioBook,‎Blue,‎Ultra-Portable,‎11.6 Inches,‎1366 x 768 pixels,‎1366 x 768 pixels,,‎NB1112MM(BLU),‎MediaTek,‎Others,‎2 GHz,‎8,‎LPDDR4,‎DDR4 SDRAM,‎4 GB,‎Emmc,‎USB,‎ARM Mali G72 MP3 @800 MHz,‎MediaTek,‎Integrated,‎Shared,,‎Integrated,‎Bluetooth,‎802.11abg,‎1,‎eMMC,‎JioOS,‎Yes,‎4000 Milliamp Hours (mAh),‎2,"‎Charger, Laptop",‎China,‎990 g
"HP 14, 13th Gen Intel Core i3-1315U Laptop (8GB DDR4,512GB SSD) Anti-Glare, Micro-Edge, 14/35.6cm, FHD, Win11, M365 Basic(1yr),Office Home24, Silver,1.4kg, FHD Camera w/Privacy Shutter, ep0341TU",-27%,"₹50,843₹50,843","36,990.",‎HP,"‎HP, SG68- Wistron Wistron Infocomm ( Chongqing) Co.Ltd., No.18-9, Baohong Avenue, Wangjia Sub-District, Yubei District, Chongqing (China)",‎HP Laptop,‎Silver,‎Clamshell,‎35.6 Centimetres,‎1920 x 1080 pixels,‎1920 x 1080 pixels,‎44.9 x 30.9 x 6.9 cm; 1.4 kg,‎BG6D4PA,‎Intel,‎Core i3,‎4.5 GHz,‎1,‎DDR4,‎DDR4 SDRAM,‎8 GB,‎SSD,‎USB,‎Intel UHD Graphics,‎Intel,‎Integrated,‎DDR4 SDRAM,,‎Integrated,‎Wi-Fi,‎802.11bgn,‎1,,‎Windows 11 Home,‎Yes,‎41 Watt Hours,‎3,"‎Laptop, charger",‎China,‎1 kg 400 g
"ULTIMUS Pro Intel Celeron Dual Core Laptop 4GB RAM, 128GB M.2 Emmc Expandable~512GB Intel HD Graphics 2.0x1 3.0x1 USB HDMI Sd Card Slot ‎LPDDR4 Dual Speaker Dual Microphone Win 11 Home Gray, 1.2 kg",-54%,"₹24,990₹24,990","11,490.",‎FUTOPIA,"‎Futopia Global Pvt Ltd, Customer Support - 9871822776, Email:- support@futopia-global.com, ‎Futopia Global Pvt Ltd, Customer Support - 9871822776, Email:- support@futopia-global.com",‎NU14U3CNC43BN-MB,‎Gray,‎Laptop,‎14.1 Inches,‎‎1366 x 768,‎‎1366 x 768,‎39.2 x 32.7 x 8.9 cm; 1.2 kg,‎NU14U3CNC43BN-MB,‎Intel,‎Celeron N4020,‎1.1 GHz,‎2,‎DDR4,‎DDR4 SDRAM,‎8 GB,‎Emmc,‎Solid State,‎Intel UHD Graphics 600,‎Intel,‎Integrated,‎GDDR4,,‎Integrated,‎Wi-Fi,‎802.11a/b/g/n/ac,‎1,,‎Windows 11 Home,,,‎2,"‎1X User Manual, Charger, Laptop, Warranty Card",‎China,‎1 kg 200 g
"HP Victus Gaming Laptop, AMD Ryzen 5 5600H, AMD 4GB Radeon RX 6500M Graphics, 15.6-inch (39.6 cm), FHD, IPS, 8GB DDR4, 512GB SSD, Backlit KB, B&O (Win 11, Blue, 2.29 kg), fb0147AX, fb0184ax",-28%,"₹63,629₹63,629","45,990.",‎HP,"‎HP, SG66 – QUANTA CQ Tech-Front (CHongqing) computer CO.,LTD 18#, comprehensive bonded zone avenue, Shapingba District 401332 Chongqing China",‎15-fb0147AX,‎Performance Blue,‎Netbook,‎39.6 Centimetres,‎1920 x 1080 pixels,‎1920 x 1080 pixels,,‎15-fb0147AX,‎AMD,‎Ryzen 5,‎4.2 GHz,‎1,‎DDR4,‎DDR4 SDRAM,‎16 GB,‎SSD,‎USB,‎AMD Radeon RX 6500M,‎AMD,‎Dedicated,‎GDDR6,,‎PCI Express,‎Wi-Fi,‎802.11ax,‎1,,‎Windows 11 Home,‎Yes,‎52.5 Watt Hours,‎3,"‎Laptop, Power Adapter, User Manual",‎China,‎3 kg 130 g
"ASUS TUF Gaming A15, AMD Ryzen 7 7435HS Gaming Laptop(NVIDIA RTX 3050-4GB/60W TGP/16GB RAM/512GB SSD/FHD/15.6""/144Hz/RGB KB/48WHr/Windows 11//Graphite Black/2.30 Kg) FA506NCR-HN054W",-25%,"₹83,990₹83,990","62,990.",‎ASUS,"‎ASUS, TECH FRONT ( CHONGQING) Computer Co. Ltd, NO 18 , Zongbao Road, Shapingba Dist,Chongquing, China",‎TUF Gaming F15,"‎Black, R7 | RTX 3050",‎Ultra-Portable,‎15.6 Inches,‎1920 x 1080 pixels,‎1920 x 1080 pixels,,‎FA506NCR-HN054W,‎AMD,‎AMD Ryzen 7,‎3.1 GHz,‎8,‎DDR5,‎DDR5 RAM,‎32 GB,‎SSD,‎USB,‎NVIDIA GeForce RTX 3050,‎NVIDIA,‎Dedicated,‎GDDR6,,‎PCI Express,‎Wi-Fi,"‎802.11bgn, Bluetooth",‎1,‎No Optical Storage,‎Windows 11 Home,‎Yes,‎48 Watt Hours,‎3,"‎Laptop, Adapter & User Manuals",‎China,‎2 kg 300 g
"Neopticon BrowseBook 14.1"" FHD IPS Laptop | Celeron N4020 Dual Core up to 2.8GHz | 4GB RAM | 128GB SSD | UHD Graphics | Win 11 Home | 38Wh | 1.3kg | Grey",-60%,"₹30,000₹30,000","11,990.",‎Neopticon,"‎Kaynes Electronics Manufacturing Pvt. Ltd. (KEMPL), Kaynes Electronics Manufacturing Pvt. Ltd. (KEMPL)",‎BrowseBook,‎Gray,‎Laptop,‎14.1 Inches,‎1920 x 1080 pixels,‎1920 x 1080 pixels,‎38.9 x 27.8 x 11.4 cm; 1.3 kg,‎BBN40412814,‎Intel,‎Celeron N4020,‎2.8 GHz,‎2,‎LPDDR4,‎DDR4 SDRAM,‎4 GB,‎SSD,,‎Intel Integrated Intel UHD Graphics,‎Intel,‎Integrated,‎DDR4 SDRAM,,‎Integrated,‎Wi-Fi,,‎1,,‎Windows 11 Home,‎Yes,‎38 Watt Hours,‎3,"‎1 adapter, 1 keyboard protection cover, 1 laptop, 1 user manual, 1 warranty card",‎India,‎1 kg 300 g
"ASUS Vivobook 15, Intel Core i3-1315U 13th Gen, 15.6"" (39.62 cms) FHD, Thin and Light Laptop (8GB RAM/512GB SSD/Win11/MS Office/Backlit Keyboard/Silver/1.7 kg), X1504VA-NJ320WS",-42%,"₹57,990₹57,990","33,799.",‎ASUS,"‎ASUS, DIGITEK (CHONGQING) Limited, B01 SEC C Airport Function Zone Lianglu Cuntan Free Trade Port Area, Yubei District, China",‎ASUS Vivobook 15,‎Silver,‎Ultra-Portable,‎15.6 Inches,‎1920 x 1080 pixels,‎1920 x 1080 pixels,‎48.79 x 31.4 x 6.4 cm; 1.7 kg,‎X1504VA-NJ320WS,‎Intel,‎Core i3,‎1.2 GHz,‎6,‎DDR4,‎DDR4 SDRAM,‎8 GB,‎SSD,‎PCIE x 4,‎Intel,‎Intel,‎Integrated,‎Shared,,‎PCI Express,"‎Bluetooth, Wi-Fi","‎802.11ax, Bluetooth",‎1,‎No Optical Storage,‎Windows 11 Home,‎Yes,‎42 Watt Hours,‎3,"‎Laptop, Adapter & User Manual",,‎1 kg 700 g
"Lenovo Smartchoice Ideapad Slim 3 13Th Gen Intel Core I7-13620H 15.3 Inch(38.8Cm) WUXGA IPS Laptop(16GB RAM/512GB SSD/Windows 11/Office Home 2024/Backlit Keyboard/1Yr ADP Free/Grey/1.6Kg),83K100CJIN",-26%,"₹89,390₹89,390","66,190.",‎Lenovo,"‎Lenovo, One of the below: Hefei Bitland Information Technology Co.,Ltd - No.4088 Jiuxiu Road National Hefei economic & technology development area Hefei Anhui China LCFC（Hefei) Electronics Technology Co., Ltd. - NO.1-3188,YUNGU ROAD, HEFEI EXPORT PROCESSING ZONE. ANHUI PROVINCE,CHINA Tech-Com(Shanghai) Computer Co Ltd - No.6 Ln.58,San-Zhuang Rd., Songjiang EPZ ShangHai, China Wistron InfoComm (Kunshan) Co.Ltd - 168# First Avenue, Kunshan Export Processing Zone, Kunshan, Jiangsu, China Compal information technology (kunshan) CO., LTD. - Address: No. 58, the 1st street, Kunshan Export Processing Zone, Jiangsu, P.R.O.C. CHINA Kunshan Hichain storage Co. Ltd - No. 88 Xinxiang Road Avenue Kunshan CBZ Wujiang Hichain warehousing LTD - No.2088 Pangjin road, Wujiang economic development area, Jiangsu, China",‎IdeaPad Slim 3,‎i7-13620H,‎Thin & Light,‎38.8 Centimetres,‎1920 x 1200 pixels,‎1920 x 1200 pixels,‎47.5 x 30.7 x 7.6 cm; 1.59 kg,‎15IRH10,‎Intel,,‎2.4,‎10,‎DDR5,‎DDR5 RAM,‎24 GB,,‎USB,‎Intel UHD Graphics,‎Intel,‎Integrated,‎Shared,,‎Integrated,‎Wi-Fi,‎802.11ax,‎1,‎No Optical Drive,‎Windows 11 Home,‎Yes,‎50 Watt Hours,‎4,‎Laptop,‎China,‎1 kg 590 g
"Acer Aspire Lite, Intel Core i3 13th Gen - 1305U, 16GB RAM, 512GB SSD, Full HD 15.6""/39.62 cm, Windows 11 Home, Steel Gray, 1.59 KG, AL15-53, Metal Body, 36 WHR, Thin and Light Premium Laptop",-40%,"₹52,990₹52,990","31,990.",‎acer,"‎ACER INDIA PRIVATE LIMITED, RS No.38/2, Sedarpet Village, Villanur Commune, Poducherry - 605111., Acer",‎Aspire Lite,‎Steel Gray,‎Laptop,‎15.6 Inches,‎1920 x 1080 pixels,‎1920 x 1080 pixels,‎48.29 x 32 x 8.9 cm; 1.59 kg,‎AL15-53,‎Intel,‎Core i3,‎3.3 GHz,‎1,‎DDR4,‎DDR4 SDRAM,‎16 GB,‎SSD,‎Solid State,‎Intel UHD Graphics,‎Intel,‎Integrated,‎DDR4 SDRAM,,‎Integrated,"‎Bluetooth, Wi-Fi",‎Bluetooth,‎1,,‎Windows 11 Home,‎Yes,‎36 Watt Hours,‎3,"‎‎1U (contains Laptop 1N, Power cord 1N, Adapter 1N, User Manual 1N)",‎China,‎1 kg 590 g
"HP 14 (2025), Intel Core i3 13th Gen 1315U - (16 GB/512 GB SSD/Intel UHD Graphics/Windows 11 Pro) Thin and Light Business Laptop/14.0"" HD Display/Ash Grey/1.4 kg/MS Office 2021",-37%,"₹55,000₹55,000","34,400.",‎HP,‎HP,‎HP 14,‎Ash Grey,‎Laptop,‎14 Inches,‎1366 x 768 pixels,‎1366 x 768 pixels,‎32.3 x 22.1 x 1.5 cm; 1.5 kg,‎HP 14,‎Intel,‎Core i3,‎4.5 GHz,‎6,‎DDR4,‎DDR4 SDRAM,‎32 GB,‎SSD,‎Solid State,‎Intel UHD Graphics,‎Intel,‎Integrated,‎Shared,,‎Integrated,"‎Bluetooth, Wi-Fi","‎802.11ax, Bluetooth",‎1,,‎Windows 11 Pro,,‎42 Watt Hours,‎3,"‎LAPTOP, POWER ADAPTER, USER GUIDE",,‎1 kg 500 g
"Primebook 2 Neo 2025 (New Launch) | 6GB RAM, 128GB Storage (Upgradable Upto 512GB) | MediaTek Helio G99 | Android 15 (PrimeOS3.0) | in-Built AI | 11.6” Thin & Light Laptop | Type-C, USB, MicroSD Ports",-36%,"₹24,990₹24,990","15,990.",‎Primebook,‎VVDN Technologies Private Limited,,‎Gray,‎Thin & Light Laptop,‎11.6 Inches,‎1366 x 768 pixels,‎1366 x 768 pixels,‎33.1 x 23.9 x 8.3 cm; 1.8 kg,,‎MediaTek,‎MediaTek Helio,‎2.2 GHz,‎1,‎LPDDR4X,‎DDR4 SDRAM,‎6 GB,‎UFS 2.2,,‎Mali-G57,‎MediaTek,‎Integrated,,,‎Integrated,"‎Bluetooth, Wi-Fi",‎802.11a/b/g/n/ac,,,‎PrimeOS 3.0,,,,"‎1 Laptop, 1 Charger, Use Manual, Welcome Card",,‎1 kg 800 g
"Acer[SmartChoice Aspire Lite 12thGen Intel Core i5-12450H Premium Laptop(Win11Home/16GB RAM/512GB SSD/IntelUHD Graphics/MSO)AL15-52H, 39.62cm(15.6"") FHD IPS Display,Backlit Keyboard,Pure Silver, 1.7KG",-33%,"₹66,999₹66,999","44,990.",‎acer,"‎ACER INDIA PRIVATE LIMITED, RS No.38/2, Sedarpet Village, Villanur Commune, Poducherry - 605111., Acer",‎Aspire Lite,‎Silver,‎Clamshell,‎15.6 Inches,‎1920 x 1080 pixels,‎1920 x 1080 pixels,‎45.29 x 33.5 x 9.9 cm; 1.7 kg,‎AL15-52H,‎Intel,‎Core i5-12450H,‎3.3 GHz,‎1,‎Lpddr 5,‎DDR5 RAM,‎16 GB,‎SSD,‎Solid State,‎Intel UHD Graphics,‎Intel,‎Integrated,‎DDR5 SDRAM,,‎Integrated,"‎Bluetooth, Wi-Fi",‎Bluetooth,‎1,,‎Windows 11 Home,‎Yes,‎54 Watt Hours,‎3,"‎‎1U (contains Laptop 1N, Power cord 1N, Adapter 1N, User Manual 1N)",‎China,‎1 kg 700 g
"Lenovo 14 (2025), Intel Core i7 12th Gen 1255U - (16 GB/512 GB SSD/Intel Iris Xe Graphics/Windows 11 Pro) Thin and Light Business Laptop/14.0"" FHD Display/Iron Grey/1.4 kg/MS Office 2021",-55%,"₹1,10,990₹1,10,990","50,490.",‎Lenovo,‎Lenovo,‎Lenovo 14,‎Iron Grey,‎Laptop,‎14 Inches,‎1920 x 1080 pixels,‎1920 x 1080 pixels,‎32.3 x 22.1 x 1.8 cm; 1.5 kg,‎Lenovo 14,‎Intel,‎Core i7-1255U,‎4.7 GHz,‎10,‎DDR4,‎DDR4 SDRAM,‎16 GB,‎SSD,‎Solid State,‎Intel Iris Xe Graphics,‎Intel,‎Integrated,‎Shared,,‎Integrated,"‎Bluetooth, Wi-Fi","‎802.11ax, Bluetooth",‎1,,‎Windows 11 Pro,,‎38 Watt Hours,‎2,"‎LAPTOP, POWER ADAPTER, USER GUIDE",,‎1 kg 500 g
"HP Pavilion x360, 13th Gen Intel Core i5-1335U (16GB DDR4, 1TB SSD) FHD, 14''/35.6 cm, Touchscreen 2-in-1, Win 11, Office 21, Silver, 1.51 kg, ek1010TU/1149tu, FPR, 5MP Camera, B&O, Backlit Laptop",-23%,"₹92,746₹92,746","71,490.",‎HP,"‎HP, HP India Sales Pvt. Ltd.",‎HP Laptop,‎Silver,‎Convertible,‎35.6 Centimetres,‎1920 x 1080 pixels,‎1920 x 1080 pixels,,‎14-ek1010TU,‎Intel,‎Core i5,‎4.6 GHz,‎10,‎DDR4,‎DDR4 SDRAM,‎16 GB,‎SSD,‎USB,‎Intel Iris Xe Graphics,‎Intel,‎Integrated,‎VRAM,,‎Integrated,"‎Bluetooth, Wi-Fi",‎802.11ax,‎1,,‎Windows 11 Home,‎Yes,‎43 Watt Hours,‎3,"‎Laptop, Power Adapter, User Manual",‎China,‎1 kg 410 g
"Dell Inspiron 3535, AMD Ryzen 5-7530U, 16GB RAM, 512GB SSD, FHD WVA IPS 15.6""/39.62 cm, Windows 11, MSO'24, Platinum Silver, 1.67kg, 120Hz, Standard Keyboard, 15 Month McAfee, Thin & Light Laptop",-11%,"₹48,322₹48,322","42,990.",‎Dell,"‎Dell India Pvt. Ltd., Dell India Pvt. Ltd.",‎Inspiron,‎Silver,‎Standard Laptop,‎15.6 Inches,‎1920 x 1080 pixels,‎1920 x 1080 pixels,‎45.9 x 35.5 x 6.9 cm; 1.67 kg,,‎AMD,‎Ryzen 5,‎4.5 GHz,‎1,‎DDR4,‎DDR4 SDRAM,‎16 GB,‎SSD,‎USB,‎Radeon Graphics,‎AMD,‎Integrated,‎DDR4 SDRAM,,‎Integrated,‎Bluetooth,‎802.11ac,‎1,,‎Windows 11 Home,‎Yes,‎41 Watt Hours,‎3,‎Laptop | Power Cable |User Manual,‎China,‎1 kg 670 g
"Dell New 15 Laptop, 15.6- Inches FHD 120Hz 250 Nits, AMD Ryzen R7-7730U, 16GB DDR4, 512 SSD, AMD Radeon Graphics, Standard Keyboard, Win 11+Office H&S 2024, Platinum Silver, Thin & Light- 1.63 Kg",-19%,"₹65,449₹65,449","52,990.",‎Dell,"‎Dell India Pvt Ltd, Dell India Pvt. Ltd.",‎Dell 15 DC15255,‎Platinum Silver,‎laptop,‎15.6 Inches,‎1920 x 1080 pixels,‎1920 x 1080 pixels,‎45.9 x 35.4 x 6.9 cm; 1.63 kg,‎Dell 15 DC15255,‎AMD,‎AMD Ryzen 7,‎4.5 GHz,‎1,‎DDR4,,‎16 GB,‎SSD,‎Solid State,‎AMD Radeon™ Graphics,‎Intel,‎Integrated,‎Shared,,‎Integrated,‎Wi-Fi,‎Bluetooth,‎1,,‎Windows 11 Home,‎Yes,‎41 Watt Hours,‎3,"‎Adapter, Keyboard, Laptop, User Manual",‎China,‎1 kg 630 g
"Dell Vostro, Intel Core i3 13th Gen - 1305U, 16GB DDR4 RAM, 512GB, FHD 15.6""/39.6 cm, Windows 11, Office H&S 2024, Carbon Grey, 1.66Kg, 120Hz 250 nits Narrow Border Display, Intel UHD Graphics Laptop",-25%,"₹54,479₹54,479","40,990.",‎Dell,"‎Dell India Pvt Ltd, Dell India Pvt. Ltd.",‎Vostro 3530,‎Cabon Black,‎Laptop,‎15 Inches,‎1920 x 1080 pixels,‎1920 x 1080 pixels,‎46.1 x 35.5 x 7.3 cm; 2 g,‎i3-1305U,‎Intel,‎Core i3,‎4.5,‎1,‎DDR4,‎DDR4 SDRAM,‎16 GB,‎SSD,‎Solid State,‎Intel UHD Graphics,‎Intel,‎Integrated,‎Shared,,‎Integrated,‎Bluetooth,‎Bluetooth,‎1,,‎Windows 11 Home,‎Yes,‎41 Watt Hours,‎3,‎Keyboard,‎China,‎2 g
"HP 15, 13th Gen Intel Core i5-1335U Laptop (16GB DDR4,512GB SSD) Anti-Glare, Micro-Edge,15.6''/39.6cm, FHD, Win11,M365,Office24, Silver,1.59kg, Iris Xe Graphics, FHD Camera w/Privacy Shutter, fd0577TU",-22%,"₹70,841₹70,841","54,990.",‎HP,"‎HP, HP India Sales Pvt. Ltd.",‎HP Laptop,‎Glacier Silver,‎Netbook,‎39.6 Centimetres,‎1920 x 1080 pixels,‎1920 x 1080 pixels,‎51.9 x 30.8 x 6.9 cm; 1.59 kg,‎fd0577TU,‎Intel,‎Core i5,‎4.6 GHz,‎10,‎DDR4,‎DDR4 SDRAM,‎16 GB,‎SSD,‎USB,‎Intel Iris Xe Graphics,‎Intel,‎Integrated,‎VRAM,,‎Integrated,‎Wi-Fi,‎Bluetooth,‎1,‎No,‎Windows 11 Home,‎Yes,‎41 Watt Hours,‎3,"‎Laptop, Power Adapter, User manual",‎China,‎1 kg 590 g
"ASUS Zenbook 14,Intel Core Ultra 7 (Series 2),Thin & Light(Intel Arc iGPU/32GB/1TB/3K OLED Touch screen/14/120Hz/Windows 11/M365 Basic (1Year)*/Office Home 2024/Foggy Silver/1.28 kg) UX3405CA-PZ348WS",-27%,"₹1,58,990₹1,58,990","1,15,990.",‎ASUS,"‎ASUS, TECH FRONT ( CHONGQING) Computer Co. Ltd, NO 18 , Zongbao Road, Shapingba Dist,Chongquing, China",‎ASUS Zenbook 14,‎Foggy Silver (Ultra 7),‎Clamshell,‎14 Inches,‎2880 x 1800 pixels,‎2880 x 1800 pixels,‎41.2 x 33 x 7.6 cm; 1.28 kg,‎UX3405CA-PZ348WS,‎Intel,‎Intel Core Ultra 7,‎2 GHz,‎16,"‎LPDDR5X, LPDDR5X, LPDDR5X",‎DDR5 RAM,‎32 GB,‎SSD,‎USB,,‎Intel,‎Integrated,‎Shared,,‎Integrated,‎Wi-Fi,‎802.11.be,‎1,‎No Optical Storage,‎Windows 11 Home,‎Yes,‎75 Watt Hours,‎4,"‎Laptop, Power Adaptor, User Guide, Warranty Documents",‎China,‎1 kg 280 g
"HP 14 (2025), 245 G10 AMD Ryzen 5 7520U Quad Core - (8 GB/512 GB SSD/AMD Radeon Graphics) Thin and Light Business Laptop/14.0"" HD Display/Ash Grey/1.36 kg",-63%,"₹78,690₹78,690","28,780.",‎HP,‎HP,‎HP 14,‎Ash Grey,‎Laptop,‎14 Inches,‎1366 x 768 pixels,‎1366 x 768 pixels,‎45.5 x 33.4 x 6.6 cm; 1.4 kg,‎HP 14,‎AMD,‎Ryzen 5,‎2.8 GHz,‎4,‎DDR4,‎DDR4 SDRAM,‎8 GB,‎SSD,‎Solid State,‎AMD Radeon Graphics,‎AMD,‎Integrated,‎Shared,,‎Integrated,"‎Bluetooth, Wi-Fi","‎802.11ax, Bluetooth",‎1,,‎Windows 11 Pro,‎Yes,‎41 Watt Hours,‎3,"‎LAPTOP, POWER ADAPTER, USER GUIDE",,‎1 kg 400 g
"Apple 2025 MacBook Air (13-inch, Apple M4 chip with 10-core CPU and 8-core GPU, 16GB Unified Memory, 256GB) - Silver",-16%,"₹99,900₹99,900","83,990.",‎Apple,"‎Apple, Apple Inc, One Apple Park Way, Cupertino, CA 95014, USA. or Apple India Private Limited 13th Floor, Prestige Minsk Square, Municipal No. 6, Cubbon Road, Bengaluru, Karnataka - 560001, India","‎13-inch MacBook Air (M4, 2025)",‎Silver,,‎13.6 Inches,,‎2560 x 1664 Pixels,‎37.79 x 28.5 x 8.3 cm; 1.24 kg,‎MW0W3HN/A,‎Apple,‎Apple M4,‎0.01 GHz,‎10,‎Unified Memory,,‎24 GB,‎SSD,,‎Apple Integrated Graphics,‎Apple,‎Integrated,‎DDR5 SDRAM,,‎Integrated,,,,‎No,‎Mac OS,‎Yes,‎53.8 Watt Hours,‎4,"‎13-inch MacBook Air, USB-C Power Adapter, USB-C to MagSafe 3 Cable (2m)",‎China,‎1 kg 240 g
