Product_Name,Discount,MRP,Selling_Price,Brand,Manufacturer,Series,Colour,Form_Factor,Standing_Screen_Display_Size,Screen_Resolution,Resolution,Package_Dimensions,Item_Model_Number,Processor_Brand,Processor_Type,Processor_Speed,Processor_Count,Memory_Technology,Computer_Memory_Type,Maximum_Memory_Supported,Hard_Disk_Description,Hard_Drive_Interface,Graphics_Coprocessor,Graphics_Chipset_Brand,Graphics_Card_Description,Graphics_RAM_Type,Graphics_Card_RAM_Size,Graphics_Card_Interface,Connectivity_Type,Wireless_Type,Number_of_HDMI_Ports,Optical_Drive_Type,Operating_System,Are_Batteries_Included,Lithium_Battery_Energy_Content,Number_of_Lithium_Ion_Cells,Included_Components,Country_of_Origin,Item_Weight
"Maxelon Power Cable & Dell Laptop Adapter Charger 65w 19.5V 3.34A (New Pin 4.5 * 3.0mm) MGJN9 for Inspiron 11 3147, 3148, 3152, i3152, 3153, 3157, 3158, 316- Black",-39%,"₹2,299₹2,299","1,405.",,,,,,,,,‎24.6 x 19.5 x 7.3 cm; 480 g,,,,,,,,,,,,,,,,,,,,,,,,,,‎China,‎480 g
"Proffisy Laptop Stand Adjustable Portable 360 Degree Rotation Aluminum Strong Ergonomic Laptop Riser for Upto 16-inch Laptop X-Shape MacBook Holder for Gaming Office, Gunmetal Gery",-40%,"₹9,999₹9,999","5,998.",‎proffisy,‎Proffisy,,‎Gunmetal Grey (FLS-X1),,,,,,‎FLS-X1,,,,,,,,,,,,,,,,,,,,,,,,‎Laptop Stand,‎China,‎807 Grams
"CLAPONE Premium Metal Laptop Stand Foldable, Aluminum Note Book Stand Portable Any Laptop Stand Adjustable Height/OverHeating Protection Laptops/MacBooks/Table and Many More (Metallic Silver, MLS001)",-41%,₹646₹646,379.,‎CLAPONE,‎SABMILJAYEGA,,,‎Foldable desktop laptop stand,,,,,‎CLAPONE-MLS001,,,,,,,,,,,,,,,,,,,,,,,,,‎China,‎30 g
Simmtronics 8GB DDR3L Laptop RAM 1600 MHz (PC 12800) with 3 Year Warranty,-73%,"₹2,690₹2,690",730.,‎Simmtronics,"‎Simmtronics, simm",,,‎SO-DIMM,,,,,‎Simmtronics 8GB DDR3,,,,,‎DDR3L,‎DDR3 SDRAM,,,,,,,,,,,,,,,,,,,,‎15 g
Geonix Trek T2 Foldable Laptop Stand with 360° Rotating Base | Multi-Angle & Height Adjustable Design | Improves Air Flow | Carbon Steel Build with Non-Slip Pads | Support Upto 17 inch (Black),-76%,"₹3,999₹3,999",979.,‎GEONIX,"‎‎Geonix International Private Limited, ‎Geonix International Private Limited",‎Trek T2,‎Black,,,,,,‎GXT2,,,,,,,,,,,,,,,,,,,,,‎No,,,"‎LN Key, Laptop stand, User manual, Wrench Tool",‎China,‎1 kg 350 g
"Maxelon Power Cable & HP Orignal 65W USB C Laptop Charger AC Adapter Replacement for HP Spectre X360,Spectre,Elitebook x360,Elitebook,Envy,Chromebook,Elite x2,ProBook Travel Type C",-39%,"₹3,292₹3,292","1,999.",‎Maxelon,‎HP,,,,,,,,‎MRH901907450,,,,,,,,,,,,,,,,,,,,,,,,,‎China,‎320 g
"HP M120 Wireless Mouse, USB-A Nano Dongle, 2.4 Ghz Wireless Connection, 6 Buttons, Up to 1600 Dpi, Optical Sensor, Ergonomic Design, 12-Month Battery Life, 3-Year Warranty, 60G±5%, Black, 7J4G4Aa",-44%,₹960₹960,540.,‎HP,"‎HP, HP India Sales Pvt. Ltd.",‎Hp M120,‎Black,,,,,,‎7J4G4AA,,,,,,,,,,,,,,,,,,,,"‎Windows XP/Vista/7/8/10/11, Android 3.2 or later, Mac IS 10.5",‎No,,,‎Mouse,‎China,‎60 g
HP Envy Urban 14 Inch Sleeve with RFID Blocking Pocket for Notebooks,-86%,"₹4,999₹4,999",676.,‎HP,‎HP,,‎Grey,‎Sleeve,‎35.56 Inches,,,,‎3KJ71AA#ABB,,,,‎1,,,,,,,,,,,,,,,,,‎No,,,‎Hp laptop bag,,‎340 g
"FACTOTECH Replacement New 19V 45W Laptop Charger for Asus Asus - 20 V, 2.5 A, 4 Mm X 1.2Mm Diameter Connector",-77%,"₹1,13,900.00₹1,13,900.00","1,139.",‎FACTOTECH,"‎FACTOTECH, FACTOTECH",,,,,,,,‎LP135W,,,,,,,,,,,,,,,,,,,,,,,,,‎China,‎100 g
"Amkette Ergo View Foldable Laptop Stand Metal, Centre Dual Hinge Support, Specially Designed for Heavy laptops with Revited Joints, 7 Adjustable Levels, Anti Slip Silicone Grips (Grey)",-71%,"₹1,499₹1,499",429.,‎Amkette,"‎Allied Electronics & Magnetics Private Limited, Allied Electronics & Magnetics Private Limited C-64/4, Okhla Phase - 2, New Delhi - 110020",,,‎Table Stand,,,,,‎Ergo Fold - Grey,,,,,,,,,,,,,,,,,,,,,,,,,‎China,‎250 g
"Lapcare Lapcam HD 720M P, Noise Isolated Microphone with Computer HD stremaing Web cam for Desktop & Laptop with mic with Wide Angle Lens & Large Sensor for Superior Low Light, Optical (Black)",-70%,"₹2,749₹2,749",829.,‎Lapcare,"‎Lapcare, Lapcare",‎Lapcam HD,‎Black,‎Laptop,,,‎1270* 720,,‎LKWCAM7298,,,,,,,,,,,,,,,,,,,,,,,,‎USB Cable,‎China,‎200 g
"Acko 2 Year Extended Warranty Plan for Laptop Between INR 20,001-30,000 (Email delivery)",-48%,"₹2,798₹2,798","1,449.",‎Acko,‎Acko,,,,,,,,,,,,,,,,,,,,,,,,,,,,,,,,,‎India,
GLUN Laptop Cooling Stand - Ergonomic Riser Holder for Desk Compatible with MacBook & Laptop,-68%,₹499₹499,161.,‎GLUN,"‎JAINONE HUB, JAINONE HUB",,‎black,,,,,,,,,,,,,,,,,,,,,,,,,,,,,,,‎China,100 g
"Gift Kya De Laptop Stand, Tablet Stand, Mobile, and Power Bank, All in One Multi Device Charging Station & Organizer, Wooden Vertical Laptop Stand Holder - Bamboo",-52%,₹999₹999,484.,‎Gift Kya De,"‎Future Works - Gift Kya De, Raipur C.G, Future Works - Gift Kya De, Raipur C.G 6262886464",,,‎Tabletop,,,,,‎GKD000586,,,,,,,,,,,,,,,,,,,,,,,,,‎India,‎249 g
"Artis AR0509 65Watt Laptop Charger/Adapter with Power Cord Compatible with Acer Laptops (19V/3.42A, 65Watt) (Pin Size: 5.5mm x 2.5mm) (BIS Certified)",-46%,"₹1,199₹1,199",649.,‎Artis,"‎Artis, Artis India, 1800 123 8195, inquiry@artis.in",‎AR-0509-65W,‎Black,‎Table top. Hand Held,,,,,‎AR-0509-65W,,,,,,,,,,,,,,,,,,,,,‎No,,,‎Power Cable,‎China,‎400 g
"ABRALE Surface Pro Charger 65 W, Microsoft Surface Pro Laptop/Tablet Charger, Compatible for Surface Pro 10/9/8/7/6/5/4/3/X, Surface Book, Surface Go/3/2/1 Adapter",-58%,"₹2,08,900.00₹2,08,900.00","2,089.",‎ABRALE,"‎ABRALE, VNJ ACCESSORIES",,,,,,,,‎65W,,,,,,,,,,,,,,,,,,,,,,,,,‎China,‎100 g
"Microsoft CZV-00005 Bluetooth, USB Arc Mouse (Light Grey)",-4%,"₹8,499₹8,499","8,190.",‎Microsoft,"‎Chicony Electronics (Dong Guan) Co. Ltd Sanzhong Gong Ye Qu, Qingxi, Dongguan, Guangdong (Province), China., Microsoft",,‎Light Gray,,‎7 Inches,,,,‎CZV-00005,,,,,,,,,,,,,,,,,,,,"‎Linux, Windows 7, Windows XP",‎Yes,‎2 Watt Hours,,‎Surface Arc mouse,‎China,‎200 g
"SWAPKART Portable Flexible Adjustable Eye Protection USB Reading Lamp with 14 LEDs and Flexible Gooseneck for,Reading,Study Notebook Laptop, Desktop, PC and MAC Computer (14 LED,Multi Colour)",-72%,₹999₹999,280.,,"‎Imported by oxygen enterprise, Oxygen enterprise",,,,,,,,,,,,,,,,,,,,,,,,,,,,,,,,,‎China,50 g
Dell Replacement 45W Adapter 19.5V pin 4.5 mm Charger for Laptops Inspiron Black with Power Cord,-82%,"₹5,000₹5,000",909.,‎VNJ,"‎VNJ, VNJ",,,,,,,,‎VNJ DELL 45W ADP M4530,,,,,,,,,,,,,,,,,,,,,,,,,‎China,‎100 g
"Artis AR0507 65Watt Laptop Charger/Adapter with Power Cord Compatible with Acer Laptops (19V/3.42A, 65Watt) (Pin Size: 5.5mm x 1.7mm) (BIS Certified)",-46%,"₹1,199₹1,199",649.,‎Artis,"‎Artis, Artis India, 1800 123 8195, inquiry@artis.in",‎AR-0507-65W,‎Black,,,,,,‎AR-0507-65W,,,,,,,,,,,,,,,,,,,,,‎No,,,‎Laptop Charger,‎China,‎400 g
Capes Elevate Armour Laptop Sleeve/Stand/Case | 2-in-1 | Carbon Fibre Black Sleeve for Laptops | Scratch & Water Resistant | Slim Protective Cover Magnetic Flap (15/16 Inch),-19%,"₹3,499₹3,499","2,849.",,‎Capes India,,‎Carbon Fibre,,,,,,‎LTP-SLV,,,,,,,,,,,,,,,,,,,,,,,,,‎China,‎458 g
"New Slim HP 65W USB C Laptop Charger Replacement for HP Spectre x360, Envy, Chromebook, Elitebook x360, Pavilion, Elite x2 Travel Type C Power Cord Ac Adapter",-70%,"₹5,000₹5,000","1,499.",‎FACTOTECH,"‎FACTOTECH, FACTOTECH",,,,,,,,‎LP170W,,,,,,,,,,,,,,,,,,,,,,,,,‎China,‎100 g
"KARRIER Backpack with Padded Laptop Compartment, Expandable Bag Pack, Bag for Office, College, Students",-70%,"₹5,999₹5,999","1,779",,,,,,,,,,,,,,,,,,,,,,,,,,,,,,,,,,,,
Laprite USB C to Smart Tip Connector 4.5 x 3.0mm for HP Laptop 100w PD Converter USB C to Smart Tip Connector,-52%,₹999₹999,479.,‎Laprite,"‎LAPRITE, LAPRITE",,,,,,,,‎LP-HP 4530 PD CONNECTOR,,,,,,,,,,,,,,,,,,,,,,,,,‎China,‎100 g
"FRONTECH Wireless Mouse, 2.4 GHz with USB Nano Receiver, 1600 DPI, Optical Tracking, Auto On/Off, Power Saver, for PC/Desktop/Mac/Laptop, 1 Year Warranty (MS-0093)",-53%,₹550₹550,259.,‎FRONTECH,"‎Frontech Private Limited, Frontech Private Limited",‎MS-0093,‎Light Green,,,,,,‎MS-0093,,,,,,,,,,,,,,,,,,,,"‎Linux, Mac OS, Windows",,,,,‎China,‎300 g
"Lemorele USB C Laptop Docking Station, 6-in-1 Dual Display Adapter with 4K Dual HDMI for MacBook Pro, MacBook Air, HP, Dell, Surface, Windows",-38%,"₹3,599₹3,599","2,249.",‎Lemorele,‎Lemorele,,,,,,,,‎LE-TC122,,,,,,,,,,,,,,,,,,,,‎Mac OS,,,,,‎China,‎65 g
Lapcare 65W AC Adapter Laptop Charger for Toshiba Satellite C55 C55t C55dt C55D L55 L55D L55t P55 P55T S55 S55T C55-a5302 C55-a5300 C655 C655D C675 C850 C855 L655 L675 Portege Z30 Z930 Z835,-48%,"₹1,099₹1,099",569.,‎Lapcare,"‎Lapcare, Lapcare",,,,,,,,‎LTOADNP1525,,,,,,,,,,,,,,,,,,,,,,,,,‎China,‎200 g
"PYB Amigo - Hard shell Laptop Bagpack Bag, 16 inch, Waterproof, Anti-theft TSA lock, USB Charging port, Compartments for devices, Passport/Card Holder",-64%,"₹5,499₹5,499","1,999",,,,,,,,,,,,,,,,,,,,,,,,,,,,,,,,,,,,
"SWAPKART 3 in 1 Screen Cleaning Kit with Brush and Micro Cloth for PC, laptops, LCD led mobiles,TV and Other Electronics(100 ML), Blue, (AZ-01) (Pack of 1)",-49%,₹299₹299,151.,,,,,,,,,,,,,,,,,,,,,,,,,,,,,,,,,,,,
Techzere Aluminium Vertical Laptop Stand Holder with Adjustable Dock Dual Slots Fits All MacBook HP Dell ASUS Chromebook -up to 20.3 '' (Black),-53%,"₹3,999₹3,999","1,899.",‎Techzere,"‎Store2508, Dankuni, West Bengal, 7439664908, Techzere",,,‎Table Stand,‎7 Inches,,,,,,,,,,,,,,,,,,,,,,,,,,,,,‎China,‎610 g
"EooCoo Case Compatible for New MacBook Pro 14 inch 2024-2021,M4 A3112 A3185 A3401 M3 A2918 A2992 M2 A2779 M1 A2442 Pro Max Chip with Touch ID,Laptop Plastic Hard Shell Cover,Smooth Shiny,Crystal Clear",-7%,"₹1,119₹1,119","1,044.",,‎EooCoo,,‎Crystal Clear,,,,,,‎A2779 A2442 A2918 A2992,,,,,,,,,,,,,,,,,,,,,,,,,‎China,‎300 g
HP Zbook 230W Slim Smart 4.5mm AC Adapter (R-41012327),-69%,"₹9,276₹9,276","2,899.",‎HP,"‎HP Inc., HP India Sales Pvt.Ltd.",,‎Black,,,,,,‎X7W50AA,,,,,,,,,,,,,,,,,,,,,,,,‎adapter,‎China,‎650 g
"ADATA Premier 16GB 3200MHz SO-DIMM DDR4 Laptop Memory, Single RAM Module, Supports Intel & AMD CPUs, XMP Profile Support, Fast Data Transfer, Enhanced Efficiency, AD4S320016G22-SGN",-37%,"₹5,999₹5,999","3,799.",‎ADATA,"‎ADATA, Adata Technology co , Ltd , 2F,No.258,Liancheng Rd , Zhonghe Dist., New Taipei City 253, Taiwan",‎‎Premier 16GB 3200MHz DDR4 SO-DIMM Laptop Memory,‎Green,‎SO-DIMM,,,,,‎AD4S320016G22-SGN,,,,,‎DDR4,‎DDR4 SDRAM,,,,,,,,,,,,,,,‎No,‎2 Kilowatt Hours,‎5,,‎Taiwan,‎20 g
"Dyazo Transparent Wireless Mouse | Dual Mode (2.4GHz & BT5.2) | Rechargeable Battery | Noise Free Clicking | Multi Device Support | Adjustable DPI | Compatible with MacBook, Laptop and PC (Orange)",-76%,"₹1,999₹1,999",479.,‎Dyazo,"‎Dyazo, Dyazo, Alliance Trade Links, F-15 Ground Floor Industrial Area Okhla Phase 1, New Delhi - 110020, Customer Care 7270000727, E-mail-support@dyazo.in",,‎Orange,,,,,,‎DZ6091,,,,,,,,,,,,,,,,,,,,"‎Mac OS, Windows",‎Yes,‎1.4 Watt Hours,‎1,‎‎Transparent Wireless Mouse,‎China,‎76.5 g
"FINGERS 1080 Hi-Res Webcam with 1080P Wide Angle Lens&Built-in USB Mic for Pc Desktops&Laptops-Hd Video Calling&Recording with Up to 1920 X 1080 Pixels,Digital,Black",-30%,"₹3,299₹3,299","2,299.",‎FINGERS,"‎Dynamic Conglomerate Pvt. Ltd., 4th Floor, Simba Tower, Vishveshwar Nagar, Goregaon, Mumbai, Maharashtra 400063, Contact: 9137141796, FINGERS",‎1080 Hi-Res Webcam,‎Black,‎Handheld,,,‎FHD,,‎1080 Hi-Res Webcam,,,,,,,,,,,,,,,,,‎Bluetooth,,,‎Android,,,,"‎1 x Brand Note, 1 x FINGERS 1080 Hi-Res Webcam, 1 x Quick Start Guide",‎India,‎136 g
"ANCIARY Full Laptop Skin Bubble-Free HD Quality Sticker for Laptops Upto 15.6"" Compatible with Apple/Dell/HP/Lenovo/Acer/Asus/Sony (Dustproof|Waterproof|Scratchproof|Reusable) - Day Dreaming FLBK1",-65%,₹499₹499,174.,‎ANCIARY,"‎ST CO, ST CO",,,,,,,,‎DAY DREAM FL BK1,,,,,,,,,,,,,,,,,,,,,,,,,‎India,‎90 g
"USB-C Power 61W Adapter Charger Replacement for MacBook Pro 13 Inch/12 Inch/14 Inch, Compatible with MacBook Air/iPad Pro/Type C Laptop,Included USBC to USBC Charger Cable",-84%,"₹10,000₹10,000","1,552.",‎FACTOTECH,"‎FACTOTECH, FACTOTECH",‎LP135W,,,,,,,‎LP135W,,,,,,,,,,,,,,,,,,,,,,,,‎USB Cable,‎China,‎310 g
VNJ ACCESSORIES Keyboard Protector Silicone Skin Cover for HP 15 Thin & Light 15.6-inches FHD Laptop Laptop (15s-gr0010au) - GR Mint,-72%,"₹1,500₹1,500",419.,‎VNJ ACCESSORIES,"‎VNJ, VNJ",,‎green,,‎15.6 Inches,,,,,,,,,,,,,,,,,,,,,,,,,,,,‎KEYBOARD COVER,‎China,‎10 g
"ATEVON 16GB DDR4 Laptop RAM 2666MHz – PC4-21300 SODIMM 260-Pin Memory Module for Notebook, Ultrabook & Mini PC – 1.2V Low Voltage, Plug & Play RAM Upgrade",-58%,"₹5,999₹5,999","2,499.",‎ATEVON,"‎ATEVON | DELHI, ATEVON | DELHI",,‎DDR4,,,,,,‎MST-3024,,,,,,,,,,,,,,,,,,,,,,,,,‎India,‎100 g
Galaxsia World Map D4 Full Vinyl Laptop Skin/Sticker/Cover for 14 Inches Laptops Laminated-Removable-HD Quality Compatible for Hp-Dell-Sony-Lenovo-Asus etc.(13.8x9.6 Inches),-38%,₹450₹450,279.,‎Galaxsia,‎Galaxsia™,,‎DESIGN 1,,,,,,"‎Galaxsia64(14"")",,,,,,,,,,,,,,,,,,,,,,,,,,‎40 g
"cimetech Mini Wireless Keyboard and Mouse, 2.4G Portable Slim Keyboard and Mouse Set with 12 Multimedia Shortcuts for Computer, PC, Laptop, Tablet, Desktop, Android SmartTV (Grey)",-8%,"₹2,599₹2,599","2,399.",‎cimetech,‎cntorich,,,,,,,,,,,,,,,,,,,,,,,,,,,,"‎Chrome OS, Linux, Mac OS, Windows",,,,,‎China,‎450 g
"amazon basics Pro Series 2.4G Wireless Ergonomic Mouse for PC, Mac, Laptop | Dual Modes | 3 Adjustable DPI Settings Up to 2400 | Shortcut Buttons | Connects up to 3 Devices (Black)",-57%,"₹2,799₹2,799","1,199.",‎amazon basics,"‎YAS Co Ltd., YAS Co. Ltd., 359, 3rd Floor, New Asia International City, Liwan Dirstrict, Guangzhou, Guangdong, China 511400",‎ABKY-M620,‎Black,,,,,,‎ABKY-M620,,,,,,,,,,,,,,,,,,,,"‎Linux, Windows 7, Windows XP",‎No,‎650 Milliampere Hour (mAh),‎1,"‎Ergonomic Mouse, User Manual",‎China,‎85 g
"Ant PC M200 Latest Vertical Wireless Mice, Wireless Ergonomic, Rechargeable,5 Adjustable DPI, Silent 2.4GHz Optical Tunnel, USB Wireless Mouse for Laptop, PC_ Black",-83%,"₹4,999₹4,999",849.,‎Ant,"‎Ant, Ant Esports",‎M200,‎Black,,,,,,‎M200,,,,,,,,,,,,,,,,,,,,"‎Chrome OS, Mac OS 9, Windows 8.1",‎Yes,,‎1,"‎Manual, Mouse, AA Battery",‎China,‎110 g
"Lapcare Compatible Adapter Charger for Toshiba 19v 3.42 65W laptops (Without Power Cable),Black",-37%,"₹1,099₹1,099",694.,‎Lapcare,"‎Lapcare, RX Infotech P LTD,1201-1208,12th Floor, Puri Business Hub, Sector-81, Faridabad, Haryana,Mobile: 8800726969",,,,,,,,‎LTOADNP1525,,,,,,,,,,,,,,,,,,,,,,,,,‎China,‎280 g
Maxelon BIS Certified Rechargeable 776622-001 HP Laptop Battery for LA03DF LA04 15-F272WM 15-F233WM 15-F211WM 752237-001 728460-001 15-F162DX 15-F039WM 15-N210DX 15-F100DX -(Black),-48%,"₹2,499₹2,499","1,289.",‎Maxelon,"‎MAX POWER 2nd floor, Room no 8,Commercial premises, plot 44B Stonewall bldg., V.A. Patel marg,Grant road Mumbai 400007., Maxelon",,,,,,,‎29.5 x 7.3 x 4.4 cm; 290 g,‎MAXBTN04019,,,,,,,,,,,,,,,,,,,,,,,,,‎China,‎290 g
"Rpi shop - Alloy Steel Universal Laptop Screws Kit for IBM, HP, Lenovo, Samsung, Dell Sony, Toshiba, 10 Different Size of M2, M2.5 & M3 Screws Each 25 pcs with Hex Nuts Pack Of 300 Pieces",-32%,₹2.15₹2.15,644.,‎Rpi shop,‎Rpi shop,,‎Natural,,,,,,‎M2ToM3_10SizeKitWithNut300Pcs,,,,,,,,,,,,,,,,,,,,,,,,,‎India,‎250 Grams
"Brainwavz Adhesive Laptop & Tablet Wall Mount Holder for MacBook, Surface, Notebooks, iPad, Galaxy Tab Note, eBooks, Kindle & More, Stick On Or Screw-in (Black)",-60%,"₹2,499₹2,499",999.,‎Brainwavz,‎BRAINWAVZ,,,,,,,‎12.8 x 9.91 x 4.5 cm; 82 g,‎BWAVZ-TABMNT02-BK,,,,,,,,,,,,,,,,,,,,,,,,,‎Hong Kong,‎82 g
"BAEYE Laptop Skin Stickers HD Quality Sticker for Laptops Upto 15.6"" (Dustproof|Waterproof|Scratchproof|Reusable) - BE Think DIF",-68%,₹499₹499,159.,‎BAEYE,"‎ST CO, ST CO",,,,,,,,‎BE THINK DIF,,,,,,,,,,,,,,,,,,,,,,,,,‎India,‎100 g
Galaxsia Pattern D83 Full Body Vinyl Laptop Skin/Sticker/Cover Upto 15.6 Inches Laptops Laminated-Removable-HD Quality Compatible for -Dell (15x10 Inches),-40%,₹499₹499,299.,‎Galaxsia,"‎Galaxsia, Galaxsia II galaxy.designslko@gmail.com",,,,,,,,‎Galaxsia772 NEW,,,,,,,,,,,,,,,,,,,,,,,,,,‎60 g
"Ant G20 Gaming Mouse, Wired Mouse with RGB Backlit and Adjustable DPI, Ergonomic Office Laptop Mouse, Computer Gamer Mouse with 7 Responsive Buttons for Windows/Mac/Linux/Chrome",-79%,"₹1,399₹1,399",299.,,,,,,,,,,,,,,,,,,,,,,,,,,,,,,,,,,,,
"Shopizone Laptop Sleeve fits Upto 11"" Laptop/MacBook, Wrinkle Free, Padded, Waterproof Light Neoprene Carrying Bag Case Cover Sleeve Pouch, for Men and Women|Blue",-77%,"₹1,299₹1,299",299.,,‎SOMI SALE E-COMMERCE PRIVATE LIMITED,,‎Blue,,,,,,‎CA-BU-2237,,,,,,,,,,,,,,,,,,,,,,,,,‎China,‎132 g
Galaxsia Indian Army D1 Full Body Vinyl Laptop Skin/Sticker/Cover Upto 15.6 Inches Laptops Laminated-Removable-HD Quality Compatible for Hp-Dell-Sony-Lenovo-Asus etc.(15x10 Inches),-50%,₹599₹599,299.,‎Galaxsia,"‎Galaxsia II galaxy.designslko@gmail.com, Galaxsia II galaxy.designslko@gmail.com",,,‎Case,,,,,‎GALAXSIA-ARMY-001-GR NEW,,,,,,,,,,,,,,,,,,,,,,,,,,‎60 g
Fedus Laptop 15.6 Inch Screen Guard Scratch Anti-Fingerprint Ultra-Clear Screen Protector,-56%,₹499₹499,219.,‎FEDUS,"‎Cheeku Technologies, khasra no-45/10, Vikas nagar Hastsal, uttam nagar, Uttam nagar NEW DELHI, DELHI, 110059",,,,‎15.6 Inches,,,,‎FEDUS_LAPTOP_SCREENGUARD_15.6_fg6,,,,,,,,,,,,,,,,,,,,,‎No,,,‎Laptop Screenguard,‎India,‎200 g
"Cason -200W Car Inverter 12V to 220V, QC3.0 Fast Charging Car Laptop Charger, Power Inverter with 2 USB (3.1A Max) + 2 Type-C (24W PD),Car Socket to Plug Adapter(Black,White)",-41%,"₹2,995₹2,995","1,782.",‎CASON,"‎CASON, DOCOSS INDIA,Mumbai-400013,Customer care (whats app only) - 9136275018",,,,,,,,‎car laptop charger car inverter,,,,,,,,,,,,,,,,,,,,,,,,,‎China,‎280 g
"ANCIARY Laptop Skin Stickers HD Quality Sticker for Laptops Upto 15.6"" Compatible with Apple/Dell/HP/Lenovo/Acer/Asus/Sony (Dustproof|Waterproof|Scratchproof|Reusable) - Iron Man EDS1",-61%,₹499₹499,192.,‎ANCIARY,"‎ST CO, ST CO",‎IRON MAN EDS1,‎IRON MAN EDS1,,,,,,‎IRON MAN EDS1,,,,,,,,,,,,,,,,,,,,,,,,,‎India,‎100 g
CRALOFT Laptop Charger Pouch/Travel Organizer Pouch for Cables/Hard Disk/Charger (PVC Sponge Leather-Black-Pack of 2),-60%,"₹1,239₹1,239",494.,,,,,,,,,,,,,,,,,,,,,,,,,,,,,,,,,,,,
"Lemorele USB C Hub Docking Station 7-in-1, Dual HDMI 4K 60Hz Display Adapter for MacBook Pro/Air, Dell, HP, Surface & Windows",-37%,"₹4,399₹4,399","2,754.",‎Lemorele,‎Lemorele,,,,,,,,‎TC510B,,,,,,,,,,,,,,,,,,,,"‎Windows, macOs, Linux, Chrome Os, Android",,,,,‎China,‎49 g
ABRALE Replacement 150W 20V 7.5A Adapter ADP-150CH B for Asuus A18-150P1A Gaming FA506 FA706 FX505GT FX705GT FX705gm FX505DU FX505DT FX505DD FX705DD FX705DT FX705DU ROG Strix Scar III G531GD,-30%,"₹4,000₹4,000","2,797.",‎ABRALE,"‎ABRALE, ABRALE",,,,,,,,‎LP-150,,,,,,,,,,,,,,,,,,,,,,,,,‎China,‎100 g
"Tobo USB C to DC Adapter,USB C Female to DC 11.0x4.5mm Barrel Jack Plug PD 100W Laptop Fast Charging Adapter with Wattage Display TD-1263CC",-83%,"₹2,999₹2,999",499.,,,,,,,,,,,,,,,,,,,,,,,,,,,,,,,,,,,,
"Crucial 16GB Single DDR4 3200 MT/S (PC4-25600) CL22 DR X8 Unbuffered SODIMM 260-Pin Memory - CT16G4SFD832A, Green",-34%,"₹6,999₹6,999","4,599.",‎Crucial,"‎CRUCIAL TECHNOLOGY, MICRON CONSUMER PRODUCTS GROUP(SINGAPORE)A DIVISION OF MICRON SEMICONDUCTOR ASIA OPERATIONSPTE. LTD.1 NORTH COAST DRIVE,SINGAPORE 757432.",,,‎260 pin_USO-DIMM,,,,,‎CT16G4SFD832A,,,,‎1,‎DDR4,‎DDR4 SDRAM,,,,,,,,,,,,,,,,,,,‎Malaysia,‎11 g
Crucial 8GB DDR5-5600 SODIMM CL46 (16Gbit),-31%,"₹3,900₹3,900","2,699.",‎Crucial,"‎Micron Consumer Products Group, Micron Consumer Products Group, Division of Micron Semiconductor Asia Operations Pte Ltd, 1 North Coast Drive, Singapore, 757432",,,‎DIMM,‎16 Inches,,,,‎CT8G56C46S5,,,,,‎DDR5,‎DDR5 SDRAM,,,,,,,,,,,,,,,,,,,‎Malaysia,‎9.4 g
ZEISS Screen Cleaning Kit 120ml,-27%,₹332.50₹332.50,399.,,‎Prospen Inc,,,,,,,,‎003900-0031-910,,,,,,,,,,,,,,,,,,,,,,,,ZEISS Screen Cleaning Kit 120ml,,205 g
"Ant PC M200 Latest Vertical Wireless Mice, Wireless Ergonomic, Rechargeable,5 Adjustable DPI, Silent 2.4GHz Optical Tunnel, USB Wireless Mouse for Laptop, PC_ Black",-83%,"₹4,999₹4,999",849.,‎Ant,"‎Ant, Ant Esports",‎M200,‎Black,,,,,,‎M200,,,,,,,,,,,,,,,,,,,,"‎Chrome OS, Mac OS 9, Windows 8.1",‎Yes,,‎1,"‎Manual, Mouse, AA Battery",‎China,‎110 g
"HP M120 Wireless Mouse, USB-A Nano Dongle, 2.4 Ghz Wireless Connection, 6 Buttons, Up to 1600 Dpi, Optical Sensor, Ergonomic Design, 12-Month Battery Life, 3-Year Warranty, 60G±5%, Black, 7J4G4Aa",-44%,₹960₹960,540.,‎HP,"‎HP, HP India Sales Pvt. Ltd.",‎Hp M120,‎Black,,,,,,‎7J4G4AA,,,,,,,,,,,,,,,,,,,,"‎Windows XP/Vista/7/8/10/11, Android 3.2 or later, Mac IS 10.5",‎No,,,‎Mouse,‎China,‎60 g
"Chuwi GemiBook Plus 15.6'' Laptop Intel N150(up to 3.60 GHz) 16GB LPDDR5 RAM 512GB SSD| Windows 11| Intel Graphics| IPS FHD 2K, Laptop for Office, Movie, Study| HDMI, WiFi 6, BT5.2, USB 3.0, Webcam",-47%,"₹44,990₹44,990","23,990.",‎Chuwi,‎CHUWI INDIA,‎GemiBook Plus,‎Iron Gray,‎Ultra-Portable,‎15.6 Inches,‎1920 x 1080 pixels,‎1920 x 1080 pixels,‎47.6 x 29.6 x 7.3 cm; 1.7 kg,‎GemiBook Plus,‎Intel,,‎3.4 GHz,‎1,‎LPDDR4,‎DDR4 SDRAM,‎16 GB,‎SSD,‎ATA-5,‎N150,‎Intel,‎Integrated,,,,"‎Bluetooth, Wi-Fi",‎802.11ax,,,‎Windows 11,,,,,,‎1 kg 700 g
Sounce SATA Cable USB 3.0 to SATA III Hard Disk Connector for 3.5 2.5 inch SSD & HDD Hard Drive Disk and SATA Optical Drive with 12V 2A Power Adapter External Hard Disk Adapter Support UASP - Black,-62%,"₹1,999₹1,999",759.,‎Sounce,"‎Sounce, Soune",,,,,,,,‎SNC-SATACBLE,,,,,,,,,,,,,,,,,,,,,,,,,‎China,‎20 g
"Lenovo 15 (2025), Windows 11 Pro Intel Core i3 12th Gen 16 GB 18 512 Slow",-46%,"₹59,990₹59,990","32,400.",‎Lenovo,‎Lenovo,‎Lenovo 15,‎Iron Grey,‎Laptop,‎15.6 Inches,‎1920 x 1080 pixels,‎1920 x 1080 pixels,‎32.3 x 22.1 x 1.8 cm; 1.5 kg,‎Lenovo 15,‎Intel,‎Core i3-1215U,‎4.4 GHz,‎6,‎DDR4,‎DDR4 SDRAM,‎16 GB,‎SSD,‎Solid State,‎Intel UHD Graphics,‎Intel,‎Integrated,‎Shared,,‎Integrated,"‎Bluetooth, Wi-Fi","‎802.11ax, Bluetooth",‎1,,‎Windows 11 Pro,‎Yes,‎65 Watt Hours,‎2,"‎LAPTOP, POWER ADAPTER, USER GUIDE",,‎1 kg 500 g
"TOURTIER Stylish Laptop Backpack for Men & Women with USB Charging Port, Compatible Laptop 15.5-inch",-50%,"₹3,999₹3,999","1,999",,,,,,,,,,,,,,,,,,,,,,,,,,,,,,,,,,,,
"EooCoo Case Compatible for New MacBook Pro 14 inch 2024-2021,M4 A3112 A3185 A3401 M3 A2918 A2992 M2 A2779 M1 A2442 Pro Max Chip with Touch ID,Laptop Plastic Hard Shell Cover,Smooth Shiny,Crystal Clear",-7%,"₹1,119₹1,119","1,044.",,‎EooCoo,,‎Crystal Clear,,,,,,‎A2779 A2442 A2918 A2992,,,,,,,,,,,,,,,,,,,,,,,,,‎China,‎300 g
"amazon basics Pro Series 2.4G Wireless Ergonomic Mouse for PC, Mac, Laptop | Dual Modes | 3 Adjustable DPI Settings Up to 2400 | Shortcut Buttons | Connects up to 3 Devices (Black)",-57%,"₹2,799₹2,799","1,199.",‎amazon basics,"‎YAS Co Ltd., YAS Co. Ltd., 359, 3rd Floor, New Asia International City, Liwan Dirstrict, Guangzhou, Guangdong, China 511400",‎ABKY-M620,‎Black,,,,,,‎ABKY-M620,,,,,,,,,,,,,,,,,,,,"‎Linux, Windows 7, Windows XP",‎No,‎650 Milliampere Hour (mAh),‎1,"‎Ergonomic Mouse, User Manual",‎China,‎85 g
"HP 15, Intel Core Ultra 5-125H AI Powered Laptop (16GB RAM, 512GB SSD), IPS, 300nits, 15.6""/39.6cm, FHD, Win 11, Office 2021, Silver, 1.65Kg, Intel Arc Graphics, FHD Camera, Backlit KB, fd1099TU",-20%,"₹80,755₹80,755","64,996.",‎HP,"‎HP, SG66 – QUANTA CQ,Tech-Front (CHongqing) computer CO.,LTD,18#, comprehensive bonded zone avenue, Shapingba District 401332 Chongqing China",‎HP Laptop,‎Core Ultra 5 + 16GB,‎Laptop,‎39.6 Centimetres,‎1920 x 1080 pixels,‎1920 x 1080 pixels,,‎15-fd1099TU,‎Intel,‎Intel Core Ultra 5,‎4.5 GHz,‎14,‎DDR5,‎DDR5 RAM,‎16 GB,‎SSD,‎USB,,‎Intel,‎Integrated,‎DDR5 SDRAM,,‎Integrated,"‎Bluetooth, Wi-Fi",‎802.11ax,‎1,,‎Windows 11 Home,‎Yes,‎41 Watt Hours,‎3,"‎Laptop, Power Adapter, User Manual",‎China,‎2 kg 480 g
"USB-C Power 61W Adapter Charger Replacement for MacBook Pro 13 Inch/12 Inch/14 Inch, Compatible with MacBook Air/iPad Pro/Type C Laptop,Included USBC to USBC Charger Cable",-84%,"₹10,000₹10,000","1,552.",‎FACTOTECH,"‎FACTOTECH, FACTOTECH",‎LP135W,,,,,,,‎LP135W,,,,,,,,,,,,,,,,,,,,,,,,‎USB Cable,‎China,‎310 g
"cimetech Mini Wireless Keyboard and Mouse, 2.4G Portable Slim Keyboard and Mouse Set with 12 Multimedia Shortcuts for Computer, PC, Laptop, Tablet, Desktop, Android SmartTV (Grey)",-8%,"₹2,599₹2,599","2,399.",‎cimetech,‎cntorich,,,,,,,,,,,,,,,,,,,,,,,,,,,,"‎Chrome OS, Linux, Mac OS, Windows",,,,,‎China,‎450 g
"Maxelon Power Cable & HP Orignal 65W USB C Laptop Charger AC Adapter Replacement for HP Spectre X360,Spectre,Elitebook x360,Elitebook,Envy,Chromebook,Elite x2,ProBook Travel Type C",-39%,"₹3,292₹3,292","1,999.",‎Maxelon,‎HP,,,,,,,,‎MRH901907450,,,,,,,,,,,,,,,,,,,,,,,,,‎China,‎320 g
